[
  {
    "id": "F01",
    "claim": "CCUSとは、CO2の分離回収（Capture）・有効利用（Utilization）・貯留（Storage）の3要素からなる技術の総称",
    "value": "分離回収・有効利用・貯留の3プロセス",
    "unit": null,
    "confidence": "confirmed",
    "source_id": "SRC01",
    "notes": "SRC30（資源エネルギー庁）でも同旨の一般向け解説あり"
  },
  {
    "id": "F02",
    "claim": "環境省はCCUSを2050年カーボンニュートラル実現に必要な技術と位置づけている",
    "value": "2050年カーボンニュートラルの実現に必要な技術と位置づけ",
    "unit": null,
    "confidence": "confirmed",
    "source_id": "SRC01",
    "notes": null
  },
  {
    "id": "F03",
    "claim": "CCS事業法（二酸化炭素の貯留事業に関する法律）は2024年に成立し、2030年までの民間CCS事業開始に向けた法的環境（貯留事業許可制度等）を整備するもの",
    "value": "2024年成立、2030年までの事業開始環境整備が目的",
    "unit": null,
    "confidence": "confirmed",
    "source_id": "SRC02",
    "notes": "施行は探査→試掘→貯留・パイプライン運搬の段階施行。各段階の正確な施行年月日は情報源間で表記に揺れがあり、スライド化前に資源エネルギー庁一次資料での再確認を推奨（research.md「未解決事項」参照）"
  },
  {
    "id": "F04",
    "claim": "GX推進法に基づき、2023～2032年度の10年間で官民合わせて150兆円超のGX投資を目指す方針",
    "value": 150,
    "unit": "兆円（10年間累計、官民合計）",
    "confidence": "confirmed",
    "source_id": "SRC29",
    "notes": "CCUSはGX投資の対象分野の一つと位置づけられるが、150兆円のうちCCUS固有の内訳は今回の調査では確認できず"
  },
  {
    "id": "F05",
    "claim": "経済産業省／JOGMECは令和6年度（2024年度）「先進的CCS事業」として、2030年度までのCO2貯留開始を目指す9案件を選定（2024年6月28日発表）",
    "value": 9,
    "unit": "案件",
    "confidence": "confirmed",
    "source_id": "SRC04",
    "notes": "国内貯留5案件＋アジア大洋州貯留4案件"
  },
  {
    "id": "F06",
    "claim": "令和6年度選定9案件の合計CO2貯留目標は年間約2,000万トン",
    "value": 20,
    "unit": "百万トン/年（合計）",
    "confidence": "confirmed",
    "source_id": "SRC05",
    "notes": "発電・石油精製・鉄鋼・化学・紙パルプ・セメント等、多様な排出産業が参画"
  },
  {
    "id": "F07",
    "claim": "苫小牧地域CCS事業：石油資源開発(JAPEX)・出光興産・北海道電力が参画し、地域内の帯水層に年間約150万～200万トンのCO2を貯留する計画",
    "value": "約150万～200万トン/年",
    "unit": "トン/年",
    "confidence": "confirmed",
    "source_id": "SRC06",
    "notes": "JOGMEC公式PDF（300390317.pdf）に掲載の情報だが、本セッションのネットワーク制限により当該PDFへの直接アクセスは不可でWebSearch経由の要約に基づく。スライド確定前の原本再確認を推奨"
  },
  {
    "id": "F08",
    "claim": "東新潟地域CCS事業：石油資源開発(JAPEX)・東北電力・三菱瓦斯化学・北越コーポレーションが参画し、県内既存油ガス田に年間約140万トンのCO2を貯留する計画",
    "value": "約140万トン/年",
    "unit": "トン/年",
    "confidence": "confirmed",
    "source_id": "SRC06",
    "notes": "F07と同様、原本未直接確認のため要再確認"
  },
  {
    "id": "F09",
    "claim": "首都圏CCS事業：INPEX・日本製鉄・関東天然瓦斯開発が参画し、日本製鉄君津地区や京葉臨海工業地帯等の排出CO2を千葉県外房沖の海域帯水層に年間約140万トン貯留する計画",
    "value": "約140万トン/年",
    "unit": "トン/年",
    "confidence": "confirmed",
    "source_id": "SRC06",
    "notes": "F07と同様、原本未直接確認のため要再確認。鉄鋼業（日本製鉄）自体がCCUSの排出側プレイヤーとして参画している実例"
  },
  {
    "id": "F10",
    "claim": "マレー半島沖北部CCS事業（海外案件）：三菱商事・ENEOS・JX石油開発・JFEスチール・コスモ石油・日本触媒とPetronas CCS Solutions（マレーシア）が参画し、東京湾臨海コンビナート等の排出CO2をマレーシア沖の減退油ガス田に年間約300万トン貯留する計画",
    "value": "約300万トン/年",
    "unit": "トン/年",
    "confidence": "confirmed",
    "source_id": "SRC06",
    "notes": "F07と同様、原本未直接確認のため要再確認。日本の排出産業（鉄鋼含む）が海外貯留地に共同でCO2を輸送・貯留するクロスボーダー型の実例"
  },
  {
    "id": "F11",
    "claim": "経済産業省「CCS長期ロードマップ検討会」最終とりまとめ（2023年3月）は、2050年時点の年間CO2貯留量目安を1.2億～2.4億トン（現在の日本のCO2排出量の約1～2割相当）と設定",
    "value": "1.2億～2.4億トン/年（2050年時点の目安）",
    "unit": "トン/年",
    "confidence": "confirmed",
    "source_id": "SRC08",
    "notes": null
  },
  {
    "id": "F12",
    "claim": "同ロードマップは2050年までのコスト削減目標として、2023年比で分離・回収コストを4分の1以下、輸送コストを7割以下、貯留コストを8割以下とする方針を示している",
    "value": "分離回収1/4以下・輸送7割以下・貯留8割以下（対2023年比）",
    "unit": null,
    "confidence": "confirmed",
    "source_id": "SRC08",
    "notes": null
  },
  {
    "id": "F13",
    "claim": "IEAのネットゼロシナリオ(NZE)では、世界のCO2回収量は2030年に年間約10～12億トン、2050年に年間約62億トンに増加すると試算されている",
    "value": "2030年:約10-12億トン/年、2050年:約62億トン/年",
    "unit": "トン/年",
    "confidence": "confirmed",
    "source_id": "SRC09",
    "notes": "文献により2050年値を7.6Gt程度とする記載もあり、出典間で幅がある点に留意"
  },
  {
    "id": "F14",
    "claim": "IEA『World Energy Outlook 2025』では、2050年までの排出削減達成手段のうちCCUSの寄与度は5%未満にとどまるとされ、近年のIEA見通しはCCUSの役割を下方修正する傾向にある",
    "value": "5%未満（2050年排出削減への寄与度）",
    "unit": "%",
    "confidence": "confirmed",
    "source_id": "SRC10",
    "notes": "IEEFA（NGO系シンクタンク）による分析記事に基づく。IEA原典での直接確認は未実施"
  },
  {
    "id": "F15",
    "claim": "世界のCCUS市場規模予測は調査会社により大きく異なり、2030年時点で129億～178億USドル程度とする予測が複数存在する（例：31億USドル(2023)→129億USドル(2030,CAGR24.0%)、46.1億USドル(2024)→152.1億USドル(2030,CAGR22.0%)、58.2億USドル(2025)→177.5億USドル(2030,CAGR25.0%)）",
    "value": "2030年時点で約129億～178億USドル（調査会社により異なる）",
    "unit": "億USドル",
    "confidence": "confirmed",
    "source_id": "SRC23",
    "notes": "SRC23/SRC24/SRC25の3つの民間市場調査（原調査会社不明、要約転載サイト経由）の数値を並記。スライドで単一の数字として提示する場合は出典を明記し、幅があることを示すこと"
  },
  {
    "id": "F16",
    "claim": "富士経済の調査によれば、2050年のCO2削減関連世界市場は198兆1,855億円（2023年比17.3倍）に達すると予測されている",
    "value": 198.1855,
    "unit": "兆円（2050年、CO2削減関連市場全体）",
    "confidence": "confirmed",
    "source_id": "SRC26",
    "notes": "CCUS単体でなく『CO2削減関連』市場全体の数値である点に注意。発表年（推定2024年）は要一次資料確認"
  },
  {
    "id": "F17",
    "claim": "CO2パイプライン輸送では、米国石油協会(API)のRP1192規格が延性破壊制御・圧力変動・腐食等の性能要件を規定しており、ラインパイプ鋼管にはAPI 5L/ISO3183に基づく強度に加え延性・低温靭性・耐座屈性が求められる",
    "value": "API RP1192 / API 5L・ISO3183準拠",
    "unit": null,
    "confidence": "confirmed",
    "source_id": "SRC15",
    "notes": "国内では高圧ガス保安協会（KHK）がCCSパイプライン基準（KHKS）を検討中（2025年時点、SRC14）"
  },
  {
    "id": "F18",
    "claim": "CO2圧入環境に水分が存在する場合、従来の油・ガス井に比べ低pHの腐食環境となるため、13%Cr以上の高合金油井管の需要が見込まれる",
    "value": "13%Cr以上の高合金鋼",
    "unit": null,
    "confidence": "confirmed",
    "source_id": "SRC12",
    "notes": "日本製鉄技報第422号（2023）に基づく技術的知見"
  },
  {
    "id": "F19",
    "claim": "液化CO2輸送船の設計例（商船三井が2024年に船級協会からAiP取得した50,000㎥級・23,000㎥級の低圧液化CO2輸送船）では、従来LNG船で用いられるニッケル鋼に代わる代替鋼材と、後熱処理(PWHT)を省略する工学的アプローチ(ECA)が採用されている",
    "value": "代替鋼材＋PWHT省略設計（ECA）",
    "unit": null,
    "confidence": "confirmed",
    "source_id": "SRC16",
    "notes": "液化CO2は液化温度がLNG(-162℃)ほど極低温ではないため、LNG船の9%ニッケル鋼のような超低温材が必須ではなく設計自由度・コスト最適化余地があることを示唆する事例"
  },
  {
    "id": "F20",
    "claim": "商船三井・日本郵船・川崎汽船を含む船社7社と造船会社（三菱造船・日本シップヤード等）が、2028年以降の国際間大規模液化CO2海上輸送の実現に向け、液化CO2輸送船の標準仕様・標準船型確立に向けた共同検討を開始した（2024年8月）",
    "value": "船社7社による標準船型確立の共同検討（2024年8月開始）",
    "unit": null,
    "confidence": "confirmed",
    "source_id": "SRC17",
    "notes": null
  },
  {
    "id": "F21",
    "claim": "阪和興業株式会社は大阪市中央区に本社を置く独立系の鉄鋼・非鉄金属専門商社であり、鉄鋼、鉄鋼原料、建材、非鉄金属、エネルギー・生活資材、化学品、食品、木材、セメント、機械等を取り扱う",
    "value": "独立系鉄鋼・非鉄金属専門商社（大阪市中央区）",
    "unit": null,
    "confidence": "confirmed",
    "source_id": "SRC19",
    "notes": "本資料の『阪和』が阪和興業株式会社を指すという前提自体はbrief.md記載の仮定であり、ユーザー確認が必要（research.md参照）"
  },
  {
    "id": "F22",
    "claim": "阪和興業の鋼板部門は、造船・建設機械・産業機械向けや建築・橋梁・土木向けの厚鋼板（厚板）を国内外の製鉄所から調達し素材として販売するほか、切断・曲げ・溶接・ショット処理等の加工を施した高付加価値の加工製品の拡販に取り組んでいる",
    "value": "厚板の調達販売＋切断・曲げ・溶接・ショット処理等の加工",
    "unit": null,
    "confidence": "confirmed",
    "source_id": "SRC18",
    "notes": "CCUS向け厚板需要への言及は同社公開情報中に確認できず。あくまで既存の厚板ビジネスの一般的な内容"
  },
  {
    "id": "F23",
    "claim": "阪和興業のFY2025/3期（2025年3月期）セグメント別売上高は、鉄鋼事業1兆1,129億円（構成比46%）、海外販売子会社4,005億円（17%）、エネルギー・生活資材事業3,838億円（16%）、リサイクルメタル事業2,188億円（9%）、プライマリーメタル事業1,704億円（7%）、食品事業1,382億円（6%）",
    "value": {"鉄鋼事業": "1兆1,129億円(46%)", "海外販売子会社": "4,005億円(17%)", "エネルギー・生活資材事業": "3,838億円(16%)", "リサイクルメタル事業": "2,188億円(9%)", "プライマリーメタル事業": "1,704億円(7%)", "食品事業": "1,382億円(6%)"},
    "unit": "億円",
    "confidence": "confirmed",
    "source_id": "SRC20",
    "notes": null
  },
  {
    "id": "F24",
    "claim": "阪和興業のFY2026/3期（2026年3月期）売上高は2兆6,626億6,900万円（前期比4.2%増）",
    "value": 266266900,
    "unit": "万円（2兆6,626億6,900万円）",
    "confidence": "confirmed",
    "source_id": "SRC20",
    "notes": null
  },
  {
    "id": "F25",
    "claim": "阪和興業は新中期経営計画「中期経営計画2028」において、最終年度（2029年3月期）の経常利益目標を750億円に設定している",
    "value": 750,
    "unit": "億円（2029年3月期 経常利益目標）",
    "confidence": "confirmed",
    "source_id": "SRC22",
    "notes": "一次IR資料での直接確認ができておらず、要約経由の情報。スライド化前に阪和興業IR資料原本での確認を推奨"
  },
  {
    "id": "F26",
    "claim": "阪和興業会長は2024年1月のインタビューで、鉄鋼事業戦略として『2030年に取扱2,000万トン』を掲げ、カーボンニュートラルを商機と位置づけて冷鉄源（スクラップ等）取引の強化に注力する方針を示した",
    "value": "2030年取扱2,000万トン目標／CNを商機と位置づけ冷鉄源取引強化",
    "unit": null,
    "confidence": "confirmed",
    "source_id": "SRC21",
    "notes": "CCUS個別の言及ではなく、脱炭素全般に関する会長発言。阪和興業がCCUSそのものに言及した公開情報は本調査では発見できなかった"
  },
  {
    "id": "F27",
    "claim": "阪和興業がCCUS分野における具体的な取り組み・プロジェクト参画・保有アセット・数値目標を公表している公開情報は、本調査の範囲では確認できなかった",
    "value": "確認できる公開情報なし",
    "unit": null,
    "confidence": "unknown",
    "source_id": null,
    "notes": "④『阪和としての介在価値』と⑥『具体的な数値目標』の核心部分はユーザー（阪和社内）からの情報提供が必須。以下のF28・F29は一般的な鉄鋼商社機能からの推論（Inference）であり、阪和興業固有の実態を示すものではない"
  },
  {
    "id": "F28",
    "claim": "（推論）鉄鋼・非鉄金属の加工商社は一般に、需要家仕様に応じた切断・二次加工、規格適合対応、在庫保有によるリードタイム短縮、物流手配、与信・在庫金融機能等を通じてメーカーと最終需要家の間の商流・リスクを仲介する役割を担っており、CCUS関連設備（CO2輸送パイプライン用鋼管、CO2貯留・輸送用タンク、CO2輸送船用厚板等）についても、素材調達の多元化、耐食・低温靭性等の要求スペックへの対応、小ロット・短納期加工需要への対応といった同種の商社機能が価値を持ちうると考えられる",
    "value": "一般的な鉄鋼商社機能（調達多元化・二次加工・在庫/物流/与信）がCCUS関連鋼材需要にも適用可能と推論される",
    "unit": null,
    "confidence": "inferred",
    "source_id": null,
    "notes": "業界構造からのAI推論。阪和興業固有の実際の対応能力・意思決定・戦略は非公開であり本調査では確認できていない。スライド化する場合は必ず推論である旨を明示し、ユーザーによる事実確認・補強が必要"
  },
  {
    "id": "F29",
    "claim": "（推論）CCUS関連鋼材（低温靭性・耐食性が求められる厚板・鋼管）で培われる加工・調達・品質保証ノウハウは、既存の造船・洋上風力・LNG関連設備向け厚板ビジネス等、他の高機能鋼材分野への横展開に応用できる可能性がある",
    "value": "CCUS向け厚板ノウハウの他分野（洋上風力・LNG関連等）への横展開可能性",
    "unit": null,
    "confidence": "inferred",
    "source_id": null,
    "notes": "AIによる業界構造からの推論。具体的な横展開の実現可能性・経済性は未検証であり、ユーザー側での事業性検討が必要"
  },
  {
    "id": "F30",
    "claim": "阪和興業固有のCCUS関連の売上目標・取扱量目標・投資額等の数値目標は、本調査では一切確認できず、公開情報としても存在しない（策定されていないか、非公開）",
    "value": "存在確認できず（プレースホルダー）",
    "unit": null,
    "confidence": "unknown",
    "source_id": null,
    "notes": "⑥『具体的な数値目標』のスライドで使える確定数値は、F05・F06・F11・F13・F15・F16等の政府目標・市場予測に限られる。阪和興業固有の数値目標はユーザーが提供・確定する必要があり、AIによる捏造は行っていない"
  }
]
